{
  "$schema": "http://json-schema.org/draft-07/schema#",
  "$id": "https://codex-dominion.ai/schemas/opening-proclamation.v1.json",
  "title": "Opening Proclamation Schema",
  "description": "Schema for Opening Proclamation making the Codex Eternum visible to all nations",
  "type": "object",
  "required": [
    "proclamation_id",
    "timestamp",
    "custodian_crown",
    "flame_visibility",
    "covenant_status",
    "public_realms",
    "invited_nations",
    "eternal_promises",
    "replay_guarantee",
    "sovereignty_seal",
    "schema_version"
  ],
  "properties": {
    "proclamation_id": {
      "type": "string",
      "pattern": "^OCP-[0-9]{4}-[0-9]{2}-[0-9]{2}-[A-F0-9]{8}$",
      "description": "Unique Opening Proclamation identifier with format OCP-YYYY-MM-DD-XXXXXXXX"
    },
    "timestamp": {
      "type": "string",
      "format": "date-time",
      "description": "ISO 8601 timestamp of when the opening proclamation was made"
    },
    "custodian_crown": {
      "type": "string",
      "description": "The sacred crown under which the proclamation is made"
    },
    "flame_visibility": {
      "type": "string",
      "enum": ["VISIBLE TO ALL NATIONS", "HIDDEN", "RESTRICTED"],
      "description": "Current visibility status of the Codex Eternum flame"
    },
    "covenant_status": {
      "type": "string",
      "enum": ["ETERNAL COVENANT ACTIVATED", "COVENANT PENDING", "COVENANT SEALED"],
      "description": "Status of the eternal covenant binding"
    },
    "public_realms": {
      "type": "array",
      "items": {
        "type": "string"
      },
      "minItems": 1,
      "description": "List of sacred realms now made publicly accessible"
    },
    "invited_nations": {
      "type": "array",
      "items": {
        "type": "string"
      },
      "minItems": 1,
      "description": "List of entities and nations welcomed to the flame"
    },
    "eternal_promises": {
      "type": "array",
      "items": {
        "type": "string"
      },
      "minItems": 1,
      "description": "Sacred promises made for the public flame"
    },
    "replay_guarantee": {
      "type": "string",
      "description": "Guarantee of invocation replayability"
    },
    "sovereignty_seal": {
      "type": "string",
      "description": "The sovereign seal validating the proclamation"
    },
    "schema_version": {
      "type": "string",
      "const": "opening-proclamation.v1",
      "description": "Schema version identifier"
    }
  },
  "additionalProperties": false
}