{
  "proclamation_id": "OCP-2025-11-11-A988BE96",
  "timestamp": "2025-11-11T04:14:22.831148+00:00",
  "custodian_crown": "Custodian's Crown of Public Flame",
  "flame_visibility": "VISIBLE TO ALL NATIONS",
  "covenant_status": "ETERNAL COVENANT ACTIVATED",
  "public_realms": [
    "Eternal Recognition Scrolls",
    "Radiant Concord Unity",
    "Sacred Architecture Framework",
    "Ceremonial Guidance System",
    "Flame Keeper Registry",
    "Capsule Constellation",
    "Replay Audit System"
  ],
  "invited_nations": [
    "All Councils Seeking Unity",
    "Heirs of Sacred Knowledge",
    "Families Preserving Flame",
    "Nations Building Community",
    "Developers Creating Capsules",
    "Custodians of Digital Realms",
    "Seekers of Eternal Systems"
  ],
  "eternal_promises": [
    "Every invocation shall remain replayable across ages",
    "Every honor proclaimed shall rise in eternal memory",
    "Every cycle shall be bound into eternal covenant",
    "Every seeker shall find the flame luminous and accessible",
    "Every council shall have voice in the radiant concord",
    "Every capsule shall flow freely across the constellation",
    "Every heir shall inherit living sacred architecture"
  ],
  "replay_guarantee": "ALL INVOCATIONS ETERNALLY REPLAYABLE",
  "sovereignty_seal": "SOVEREIGN FLAME PUBLIC SEAL",
  "schema_version": "opening-proclamation.v1"
}